E	03004000	-	Z axis homing failed; the task has been stopped.
E	03004001	-	The printer timed out waiting for the nozzle to cool down before homing.
E	03004002	-	Auto Bed Leveling failed; the task has been stopped.
E	03004005	-	The hotend cooling fan speed is abnormal.
E	03004006	-	The nozzle is clogged.
E	03004008	-	The AMS failed to change filament.
E	03004009	-	Homing XY axis failed.
E	0300400A	-	Mechanical resonance frequency identification failed.
E	0300400B	-	Internal communication exception
E	0300400C	-	The task was canceled.
E	0300400D	-	Resume failed after power loss.
E	0300400E	-	The motor self-check failed.
E	0300400F	-	The power supply voltage does not match the printer.
E	03004010	-	Nozzle offset calibration failed.
E	03004011	-	Flow Dynamics Calibration failed; please reinitiate printing or calibration.
E	03004013	-	Printing cannot be initiated while AMS is drying.
E	03004014	-	Homing Z axis failed: temperature control abnormality.
E	03004015	-	Nozzle clumping detection calibration failed. Please go to 'Assistant' for troubleshooting.
E	03004016	-	Nozzle cleaning failed. Please click the Assistant for troubleshooting.
E	0300401F	-	The hotend is not installed, and the toolhead cannot perform homing. Please install the hotend and then continue.
E	0300401F	H2D	The right hotend is not installed, and the toolhead cannot perform homing. Please install the hotend and then continue.
E	03004020	-	The nozzle presence detection failed. Please check the Assistant for details.
E	03004021	-	Nozzle offset calibration sensor signal abnormality detected. Please check the sensor and retry.
E	03004042	-	The Laser Safety Window is not properly installed. The task has been stopped.
E	03004044	-	The Flame Sensor is abnormal. The sensor may be short-circuited. Please troubleshoot the issue before starting a print job.
E	0300404B	-	Task aborted because the front door or top cover is open.
E	0300404D	-	The current temperature of the hotend, heatbed, or chamber is too high. Please wait for it to cool down to room temperature before restarting the task.
E	03004050	-	Liveview Camera calibration timeout; please restart the printer.
E	03004052	-	Blade Z-axis homing failed
E	03004057	-	Z-axis step loss detected. The task has stopped. Please check if there are any obstructions beneath the heatbed.
E	03004066	-	Calibration of motion precision failed.
E	03004067	-	Calibration result is over the threshold.
E	03004068	-	Step loss occurred during the motion accuracy enhancement process. Please try again.
E	03008000	-	Printing was paused for unknown reason. You can select 'Resume' to resume the print job.
E	03008001	-	Printing was paused by the user. You can select 'Resume' to continue printing.
E	03008002	-	First layer defects were detected by the Micro Lidar. Please check the quality of the printed model before continuing your print.
E	03008003	-	Spaghetti defects were detected by the AI Print Monitoring. Please check the quality of the printed model before continuing your print.
E	03008004	-	Filament ran out. Please load new filament.
E	03008005	-	Toolhead front cover fell off. Please remount the front cover and check to make sure your print is going okay.
E	03008006	-	The build plate marker was not detected. Please confirm the build plate is correctly positioned on the heatbed with all four corners aligned, and the marker is visible.
E	03008007	-	There was an unfinished print job when the printer lost power. If the model is still adhered to the build plate, you can try resuming the print job.
E	03008008	-	Nozzle temperature malfunction
E	03008009	-	Heatbed temperature malfunction
E	0300800A	-	A Filament pile-up was detected by AI Print Monitoring. Please clean filament from the waste chute.
E	0300800B	-	The cutter is stuck. Please make sure the cutter handle is out and check the filament sensor cable connection.
E	0300800C	-	Skipped step detected: auto-recover complete; please resume print and check if there are any layer shift problems.
E	0300800D	-	Detected that the extruder is not extruding normally. If the defects are acceptable, select 'Resume' to resume the print job.
E	0300800E	-	The print file is not available. Please check to see if the storage media has been removed.
E	0300800F	-	The door seems to be open, so printing was paused.
E	03008010	-	The hotend cooling fan speed is abnormal.
E	03008011	-	Detected build plate is not the same as the Gcode file. Please adjust slicer settings or use the correct plate.
E	03008013	-	Printing paused due to the pause command added to the printing file.
E	03008014	-	The nozzle is covered with filament, or the build plate is installed incorrectly. Please cancel this print and clean the nozzle or adjust the build plate according to the actual status. You can also select 'Resume' to resume the print job.
E	03008015	-	The filament on external spool has run out; please load new filament. If the filament is loaded, please select 'Resume'.
E	03008016	-	The nozzle is clogged with filament. Please cancel this print and clean the nozzle or select 'Resume' to resume the print job.
E	03008017	-	Foreign objects detected on heatbed. Please check and clean the heatbed. Then, select 'Resume' to resume the print job.
E	03008018	-	Chamber temperature malfunction.
E	03008019	-	No build plate is placed.
E	0300801A	-	Filament extrusion error; please check the assistant for troubleshooting. After resolving the issue, decide whether to cancel or resume the print job based on the actual print status.
E	0300801B	-	Nozzle temperature problem detected. Refer to Assistant to re-connect the hotend connector. POWER OFF the printer before this operation to avoid short circuits.
E	0300801C	-	The extrusion resistance is abnormal. The extruder may be clogged; please refer to the assistant. After trouble shooting, you can select 'Resume' to resume the print job.
E	0300801D	-	The extruder servo motor position sensor is malfunctioning. Please power off the printer first and check if the connection cable is loose.
E	0300801E	-	The extrusion motor is overloaded, please check the Assistant for details.
E	03008021	-	The nozzle may not be installed or not properly installed. Please ensure the nozzle is correctly installed before proceeding.
E	03008022	-	The heatbed may be obstructed while moving downward. Please clear any objects beneath the heatbed and check for any resistance or jamming during its movement.
E	03008028	-	Nozzle offset calibration sensor error. If using a single hotend or the calibration function is disabled, you may ignore this and continue printing; otherwise, it is recommended to check the sensor before proceeding.
E	03008041	-	Platform detection timeout: please restart the printer.
E	03008042	-	Task paused because the door or top cover is open.
E	03008042	P2S	Task paused because the door is open.
E	03008043	-	The laser module is abnormal.
E	03008044	-	Fire was detected inside the chamber.
E	03008045	-	Material detection timeout: please restart the printer.
E	03008046	-	Foreign object detect timeout: please restart the printer.
E	03008047	-	Quick-release lever detection time out: please restart the printer.
E	03008048	-	Laser Module unlock has timed out, and the task cannot proceed. Please restart the printer and try again.
E	03008049	-	The current plate is invalid.
E	0300804A	-	Emergency stop button improperly installed. Please reinstall according to the Wiki before proceeding.
E	0300804B	-	Task paused. The Laser Safety Window is open.
E	0300804E	-	This is a printing task. Please detach the Laser/Cutting Module from the Toolhead.
E	0300804F	-	The loading/unloading process is currently ongoing. Please stop the process or remove the laser/cutting module.
E	03008050	-	This device does not support the 40W Laser Module. Please remove it or replace it with a 10W Laser Module.
E	03008051	-	The cutting module has dropped or the cutting module cable is disconnected; please check the module.
E	03008053	-	Laser module detected. Please install the right nozzle correctly to ensure proper Laser Module Mounting Calibration.
E	03008054	-	Please place the paper required for Print Then Cut.
E	03008055	-	The module mounted on the toolhead does not match the task. Please install the correct module.
E	03008057	-	The rotary attachment is disconnected. Please ensure it is properly installed and the cable is securely plugged in.
E	03008058	-	The rotary attachment is detected. Please remove it before continuing.
E	03008061	-	The mode of Airflow System failed to activate; check the air door condition.
E	03008062	-	The chamber temperature is too high. It may be due to high environmental temperature.
E	03008063	-	The chamber temperature is too high. Please open the top cover and front door to cool down.
E	03008064	-	The chamber temperature is too high. Please open the top cover and front door to cool down. (Open door detection for this print job will be set to 'Notification' level)
E	03008065	-	The temperature of the MC module is too high. Please check the Wiki for possible explanations.
E	03008071	-	The Toolhead Enhanced Cooling Fan module is malfunctioning.
E	0300807D	-	Fire Extinguisher not detected, the automatic extinguishing function will be unavailable.
E	0300807E	-	Fire Extinguisher not detected, the automatic extinguishing function will be unavailable.
E	0300807F	-	Fire Extinguisher is malfunctioning.
E	03008080	-	Fire extinguisher motor reset failed.
E	03008081	-	Fire extinguisher cylinder not installed. Please confirm on the extinguisher page.
E	03008082	-	The Fire Extinguisher Gas Cylinder is empty.
E	0300C012	-	Please heat the nozzle to above 170°C.
E	0300C056	-	A minor fire was detected inside the chamber, and the Auto Fire Extinguishing process has been aborted.
E	0300C070	-	The fire extinguisher has been detected and is ready for use after the laser module is connected.
E	05004001	-	Failed to connect to Bambu Cloud. Please check your network connection.
E	05004002	-	Unsupported print file path or name. Please resend the print job.
E	05004003	-	Printing stopped because the printer was unable to parse the file. Please resend your print job.
E	05004004	-	Device is busy and cannot start new task. Please wait for current task to complete before sending new task.
E	05004005	-	Print jobs are not allowed to be sent while updating firmware.
E	05004006	-	There is not enough free storage space for the print job. Restoring to factory settings can free up available space.
E	05004007	-	The device requires a repair upgrade, and printing is currently unavailable.
E	05004008	-	Starting printing failed; please power cycle the printer and resend the print job.
E	05004009	-	Print jobs are not allowed to be sent while updating logs.
E	0500400A	-	The file name is not supported. Please rename and restart the print job.
E	0500400B	-	There was a problem downloading a file. Please check your network connection and resend the print job.
E	0500400C	-	Please insert a MicroSD card and restart the print job.
E	0500400D	-	Please run a self-test and restart the print job.
E	0500400E	-	Printing was cancelled.
E	0500400F	-	AMS is initializing and cannot be upgraded at the moment. Please try again later.
E	05004010	-	AMS is drying and cannot be upgraded at the moment. Please try again later.
E	05004011	-	The printer is loading or unloading filament and cannot be upgraded at the moment. Please try again later.
E	05004012	-	The device is printing and cannot be upgraded at the moment. Please try again later.
E	05004013	-	AMS is in operation and cannot be upgraded at the moment. Please try again when it is idle.
E	05004014	-	Slicing for the print job failed. Please check your settings and restart the print job.
E	05004015	-	There is not enough free storage space for the print job. Please format or clear files from the MicroSD card to free up space.
E	05004016	-	The MicroSD Card is write-protected. Please replace the MicroSD Card.
E	05004017	-	Binding failed. Please retry or restart the printer and retry.
E	05004018	-	Binding configuration information parsing failed; please try again.
E	05004019	-	The printer has already been bound. Please unbind it and try again.
E	0500401A	-	Cloud access failed. Possible reasons include network instability caused by interference, inability to access the internet, or router firewall configuration restrictions. You can try moving the printer closer to the router or checking the router configuration before trying again.
E	0500401B	-	Cloud response is invalid. If you have tried multiple times and are still failing, please contact customer support.
E	0500401C	-	Cloud access is rejected. If you have tried multiple times and are still failing, please contact customer support.
E	0500401D	-	Cloud access failed, which may be caused by network instability due to interference. You can try moving the printer closer to the router before you try again.
E	0500401E	-	Cloud response is invalid. If you have tried multiple times and are still failing, please contact customer support.
E	0500401F	-	Authorization timed out. Please make sure that your phone or PC has access to the internet, and ensure that the Bambu Studio/Bambu Handy APP is running in the foreground during the binding operation.
E	05004020	-	Cloud access rejected. If you have tried multiple times and are still failing, please contact customer support.
E	05004021	-	Cloud access failed, which may be caused by network instability due to interference. You can try moving the printer closer to the router before you try again.
E	05004022	-	Cloud response is invalid. If you have tried multiple times and are still failing, please contact customer support.
E	05004023	-	Cloud access rejected. If you have tried multiple times and are still failing, please contact customer support.
E	05004024	-	Cloud access failed. Possible reasons include network instability caused by interference, inability to access the internet, or router firewall configuration restrictions. You can try moving the printer closer to the router or checking the router configuration before you try again.
E	05004025	-	Cloud response is invalid. If you have tried multiple times and are still failing, please contact customer support.
E	05004026	-	Cloud access rejected. If you have tried multiple times and are still failing, please contact customer support.
E	05004027	-	Cloud access failed; this may be caused by network instability due to interference. You can try moving the printer closer to the router before you try again.
E	05004028	-	Cloud response is invalid. If you have tried multiple times and are still failing, please contact customer support.
E	05004029	-	Cloud access is rejected. If you have tried multiple times and are still failing, please contact customer support.
E	0500402A	-	Failed to connect to the router, which may be caused by wireless interference or being too far away from the router. Please try again or move the printer closer to the router and try again.
E	0500402B	-	Router connection failed due to incorrect password. Please check the password and try again.
E	0500402C	-	Failed to obtain IP address, which may be caused by wireless interference resulting in data transmission failure or the DHCP address pool of the router being full. Please move the printer closer to the router and try again. If the issue persists, please check router settings to see whether the IP addresses have been exhausted.
E	0500402D	-	System exception
E	0500402E	-	The system does not support the file system currently used by the MicroSD card. Please replace the MicroSD card or format it to FAT32.
E	0500402E	P2S,H2S,H2D	System does not support the file system currently used by the USB flash drive. Please replace or format the USB flash drive to FAT32.
E	0500402F	-	The MicroSD card sector data is damaged. Please use the SD card repair tool to repair or format it. If it still cannot be identified, please replace the MicroSD card.
E	0500402F	P2S,H2S,H2D	USB flash drive sector data is damaged; please format it. If it still cannot be recognized, please replace the USB flash drive.
E	05004030	-	The device is currently upgrading. Please try again when it is idle.
E	05004031	-	The accessory firmware does not match the printer. Please update it on the 'Firmware' page.
E	05004033	-	The AMS firmware does not match the printer. Please update it on the 'Firmware' page.
E	05004034	-	The Laser Module firmware does not match the printer. Please update it on the 'Firmware' page.
E	05004035	-	The BirdsEye Camera is malfunctioning. Please try restarting the device. If the issue persists after multiple restarts, check the camera connection status or contact customer support.
E	05004037	-	Your sliced file is not compatible with current printer model. This file can't be printed on this printer.
E	05004038	-	The nozzle diameter in sliced file is not consistent with the current nozzle setting. This file can't be printed.
E	05004039	-	The current task does not allow the installation of the laser/cutting module, and the task has been halted.
E	0500403A	-	The current temperature is too low. In order to protect you and your printer, printing tasks, moving an axis and other operations are disabled. Please move the printer to an environment above 10 degrees Celsius.
E	0500403B	-	Laser/cutting tasks cannot be initiated on the machine at the moment. Please use the computer software to start the task.
E	0500403C	-	The current nozzle setting does not match the slicing file. Continuing to print may affect print quality. It is recommended to re-slice before starting the print.
E	0500403D	-	The toolhead module is not set up. Please set it up before initiating the task.
E	0500403E	-	The current tool head does not support initialization.
E	0500403F	-	Failed to download print job; please check your network connection.
E	05004040	-	The printer has reached its power limit. Please connect a dedicated power adapter to this AMS to enable drying.
E	05004041	-	The AMS drying cannot be started during printing.
E	05004042	-	Due to power limitations, starting AMS drying will pause current operations such as nozzle heating and fan running. Do you want to proceed with drying?
E	05004043	-	Due to power limitations, only one AMS is allowed to use the device's power for drying.
E	05004044	-	BirdsEye Camera malfunction: please contact customer support.
E	05004045	-	Hotend check in progress. This operation is temporarily unavailable. Please wait.
E	05004050	-	Error detected on the print board.
E	05004052	-	Error detected on the hot end.
E	05004054	-	Error detected on the mat.
E	0500405D	-	Laser module Serial Number error: unable to calibrate or make project.
E	05004065	-	The task requires a Laser Platform, but the current one is a Cutting Platform. Please replace it, measure the material thickness in the software, and then restart the task.
E	05004070	-	The laser or cutter module is connected, so the device cannot initiate a 3D printing task.
E	05004075	-	No Laser Platform was detected, which may affect thickness measurement accuracy. Please place the laser platform correctly and ensure the rear markers are not blocked, then restart the thickness measurement in the software before initiating the task.
E	05004076	-	Please place the Laser Platform correctly and ensure the rear markers are not blocked, then restart the thickness measurement in the software before initiating the task.
E	05004097	-	The device cannot detect the Laser Module. Please reconnect the module cable or restart the printer.
E	05004098	-	The device cannot detect AMS A. Please reconnect the AMS cable or restart the printer.
E	05004099	-	The firmware of Cutting Module does not match the printer; the device cannot continue working. Please update it on the 'Firmware' page.
E	0500409A	-	The firmware of the Air Pump does not match the printer; the device cannot continue working. Please update it on the 'Firmware' page.
E	0500409B	-	The firmware of the Laser Module does not match the printer; the device cannot continue working. Please update it on the 'Firmware' page.
E	0500409D	-	The firmware of AMS A does not match the printer; the device cannot continue working. Please upgrade it on the 'Firmware' page.
E	0500409E	-	The device cannot detect the Cutting Module. Please reconnect the module cable or restart the printer.
E	0500409F	-	The device cannot detect the Air Pump. Please reconnect the module cable or restart the printer.
E	050040A0	-	The Rotary Attachment module is not detected. Please reconnect the cable or restart the printer.
E	050040A1	-	The Auto Fire Extinguishing System is not detected. Please reconnect the module cable or restart the printer.
E	050040A3	-	AMS(or AMS lite) A communication is abnormal. Please reconnect the module cable or restart the printer.
E	050040A4	-	The current firmware only supports 1 AMS Lite. Please remove all AMS units before reconnecting the supported AMS Lite device.
E	050040A5	-	The current firmware only supports AMS/AMS 2 Pro/AMS HT, with a maximum of 4 units. Please remove all AMS units before reconnecting the supported one.
E	05008013	-	The print file is not available. Please check to see if the storage media has been removed.
E	05008030	-	
E	05008036	-	Your sliced file is not consistent with the current printer model. Continue?
E	0500803C	-	The current nozzle setting does not match the slicing file. Continuing to print may affect print quality. It is recommended to re-slice before starting the print.
E	05008040	-	Toolhead front cover is detached. Moving the toolhead may damage the printer. Do you want to continue?
E	05008041	-	The filament in hotend is too cold. Extrusion may damage the extruder. Still feeding in/out the filament?
E	05008048	-	The module on the toolhead is not calibrated. Please cancel the task to perform calibration or switch to a calibrated module.
E	05008051	-	Detected build plate is not the same as the Gcode file. Please adjust slicer settings or use the correct plate.
E	05008053	-	Nozzle mismatch was detected during printing. Please initiate the print after re-slicing, or continue printing after replacing with the correct nozzle. Caution: the hotend temperature is high.
E	05008053	H2D	The left and right nozzle is not matched with slicing file. Please initiate the print after re-slicing, or continue printing after replacing with the correct nozzle. Caution: the hotend temperature is high.
E	05008055	-	Laser module is installed, but a Cutting Platform is detected. Please place a Laser Platform and perform laser calibration.
E	05008056	-	Cutting module is installed, but the laser platform is detected. Please place the cutting platform for calibration.
E	05008058	-	Please place the light grip cutting mat correctly and ensure the marker is exposed.
E	05008059	-	Cutting platform base is not correctly aligned. Please ensure that the four corners of the platform are aligned with the heatbed.
E	0500805A	-	Please place the cutting mat on cutting protection base.
E	0500805B	-	The cutting mat type is unknown; please replace it with the correct cutting mat.
E	0500805C	-	The grip cutting mat type does not match; please place a LightGrip cutting mat.
E	0500805E	-	Cutting module Serial Number error: unable to calibrate or make project.
E	05008060	-	The current module on toolhead does not meet requirements. Please replace the module as per the on-screen instructions.
E	05008061	-	No print plate detected. Please make sure it is placed correctly.
E	05008062	-	The print plate marker was not detected. Please confirm the print plate is correctly positioned on the heatbed with all four corners aligned, and the marker is visible. If strong light is shining on the print sheet, consider closing the front door and blocking external light sources.
E	05008063	-	The platform is not detected during calibration; please make sure the Laser Platform is properly placed.
E	05008064	-	Please place the Laser Platform correctly and ensure the rear markers are not blocked for laser calibration.
E	05008066	-	The task requires a Cutting Platform, but the current one is a Laser Platform. Please replace it with a Cutting Platform (Cutting Protection Base + LightGrip cutting mat).
E	05008067	-	Please place a LightGrip cutting mat on the cutting protection base.
E	05008068	-	Please place the strong grip cutting mat correctly and ensure the marker is exposed.
E	05008069	-	Unable to recognize the left and right hotends. They might be third party hotends, or the hotend marks may be dirty. Please manually set the hotend types.
E	0500806A	-	Unable to recognize the left and right hotends. They might be third party hotends, or the hotend marks may be dirty. Please set hotend types on printer screen before next print.
E	0500806B	-	Quick-release Lever is not locked. Please press down the external toolhead module to ensure it is properly seated, then push down the level to lock it in place.
E	0500806C	-	Please place the cutting platform correctly and ensure the marker is exposed.
E	0500806D	-	Material not detected. Please confirm placement and continue.
E	0500806E	-	Foreign objects detected on heatbed; please check and clean up the heatbed.
E	0500806F	-	The grip cutting mat type does not match; please place a StrongGrip cutting mat.
E	05008071	-	No cutting platform was detected. Please confirm that it has been correctly placed.
E	05008072	-	Live View camera is blocked
E	05008073	-	Heatbed limit block is obstructed or contaminated. Please clean and ensure the limit block is visible, otherwise platform position offset detection may be inaccurate.
E	05008074	-	The Laser Platform is offset. Please ensure that the four corners of the platform are aligned with the heatbed, and the marker is not obstructed.
E	05008077	-	The visual marker was not detected. Please ensure the paper is properly placed.
E	05008078	-	Current material does not match the sliced file settings. Please load the correct material and ensure the QR code on the material is not damaged or dirty.
