E	05008079	-	Please place the Laser Test Material (350g paperboard) and position support strips underneath to prevent material warping.
E	0500807A	-	The foreign object detection function is not working. You can continue the task or check the assistant for troubleshooting.
E	0500807B	-	Please place the cutting platform (cutting protection base + LightGrip cutting mat).
E	0500807C	-	Please place the cutting platform (cutting protection base + StrongGrip cutting mat).
E	0500807D	-	This task requires a Cutting Platform, but the current one is a Laser Platform. Please replace it with a Cutting Platform (Cutting Protection Base + StrongGrip Cutting Mat).
E	0500807E	-	Please place a StrongGrip cutting mat on the cutting protection base.
E	05008080	-	The left and right hotends are not installed.
E	05008081	-	The left and right hotends are not installed.
E	05008082	-	Please remove the protective film on the Opaque Glossy Acrylic before processing
E	05008083	-	Material is not allowed in Mounting Calibration. Please remove the material from the platform.
E	05008084	-	The Live View Camera is dirty; please clean it and continue.
E	05008085	-	Toolhead camera is obstructed
E	05008086	-	Toolhead Camera is dirty, which affects the AI function; please clean the lens surface.
E	05008087	-	BirdsEye camera is obstructed
E	05008088	-	The Birdseye Camera is dirty
E	05008089	-	Task paused due to Presence Check failed. Please check the printer to continue.
E	0500808A	-	The BirdsEye Camera is installed offset. Please refer to the assistant to reinstall it.
E	0500808B	-	The BirdsEye Camera setup failed. Please remove all objects and the mat on the heatbed to ensure the heatbed markers are visible. Meanwhile, please ensure the BirdsEye Camera is installed correctly and remove any obstructions that may block the camera's view.
E	0500808C	-	Detected build plate offset. Please align the build plate with the heatbed, and then continue.
E	0500808D	-	The Cutting Module offset calibration failed, which may result in inaccurate cuts. Please ensure the cutting material is properly positioned and check whether the cutting blade tip is worn.
E	0500808E	-	BirdsEye Camera initialization failed. The toolhead camera did not detect the Heatbed features. Please clean the Heatbed, remove all objects and pads, and ensure the bed markings are visible. Check Assistant for a detailed solution.
E	0500808F	-	Nozzle camera lens is dirty, affecting AI monitoring. Clean the lens with a non-woven cloth and a small amount of alcohol. Beware of hotend heat; wait for it to cool before handling.
E	05008090	-	Please attach the 80g White Printing Paper to the center area of the platform.
E	05008091	-	The Cutting Module offset calibration failed, which may result in inaccurate cuts. Please ensure the 80g white printer paper(letter paper thickness) is properly positioned and check whether the cutting blade tip is worn.
E	05008092	-	Toolhead Camera initialization failed. This print can still continue, but some AI functions will be disabled. If you encounter this issue again after restarting, please contact customer support.
E	05008093	-	The nozzle silicone sleeve is not installed; there is a risk of temperature control failure. Please install it correctly and try again.
E	050080A0	-	The visual encoder board was not detected. Please check if the board is properly placed and aligned at all four corners, and ensure the positioning markings are clear and free from wear.
E	0500C010	-	MicroSD Card read/write exception: please reinsert or replace the MicroSD Card.
E	0500C010	P2S,H2S,H2D	USB flash drive read-write exception; please reinsert or replace it.
E	0500C011	-	
E	0500C011	P1P,P1S	SD card performance has degraded, which may affect printing, logging, and video. Try formatting it. If issues persist, please replace the SD card.
E	0500C032	-	Laser/Cutting module connected to the toolhead. The drying process has been automatically stopped.
E	0500C036	-	This is a printing task. Please detach the Laser/Cutting Module from the Toolhead.
E	0500C07F	-	Device is busy and cannot perform this operation. To proceed, please pause or stop the current task.
E	05014017	-	Binding failed. Please retry or restart the printer and retry.
E	05014018	-	Binding configuration information parsing failed; please try again.
E	05014019	-	The printer has already been bound. Please unbind it and try again.
E	0501401A	-	Cloud access failed. Possible reasons include network instability caused by interference, inability to access the internet, or router firewall configuration restrictions. You can try moving the printer closer to the router or checking the router configuration before trying again.
E	0501401B	-	Cloud response is invalid. If you have tried multiple times and are still failing, please contact customer support.
E	0501401C	-	Cloud access is rejected. If you have tried multiple times and are still failing, please contact customer support.
E	0501401D	-	Cloud access failed, which may be caused by network instability due to interference. You can try moving the printer closer to the router before you try again.
E	0501401E	-	Cloud response is invalid. If you have tried multiple times and are still failing, please contact customer support.
E	0501401F	-	Authorization timed out. Please make sure that your phone or PC has access to the internet, and ensure that the Bambu Studio/Bambu Handy APP is running in the foreground during the binding operation.
E	05014020	-	Cloud access rejected. If you have tried multiple times and are still failing, please contact customer support.
E	05014021	-	Cloud access failed, which may be caused by network instability due to interference. You can try moving the printer closer to the router before you try again.
E	05014022	-	Cloud response is invalid. If you have tried multiple times and are still failing, please contact customer support.
E	05014023	-	Cloud access rejected. If you have tried multiple times and are still failing, please contact customer support.
E	05014024	-	Cloud access failed. Possible reasons include network instability caused by interference, inability to access the internet, or router firewall configuration restrictions. You can try moving the printer closer to the router or checking the router configuration before you try again.
E	05014025	-	Cloud response is invalid. If you have tried multiple times and are still failing, please contact customer support.
E	05014026	-	Cloud access rejected. If you have tried multiple times and are still failing, please contact customer support.
E	05014027	-	Cloud access failed; this may be caused by network instability due to interference. You can try moving the printer closer to the router before you try again.
E	05014028	-	Cloud response is invalid. If you have tried multiple times and are still failing, please contact customer support.
E	05014029	-	Cloud access is rejected. If you have tried multiple times and are still failing, please contact customer support.
E	05014031	-	Device discovery binding is in progress, and the QR code cannot be displayed on the screen. You can wait for the binding to finish or abort the device discovery binding process in the APP/Studio and retry scanning the QR code on the screen for binding.
E	05014032	-	QR code binding is in progress, so device discovery binding cannot be performed. You can scan the QR code on the screen for binding or exit the QR code display page on screen and try device discovery binding.
E	05014033	-	Your APP region does not match with your printer; please download the APP in the corresponding region and register your account again.
E	05014034	-	The slicing progress has not been updated for a long time, and the printing task has exited. Please confirm the parameters and reinitiate printing.
E	05014035	-	The device is in the process of binding and cannot respond to new binding requests.
E	05014038	-	The regional settings do not match the printer; please check the printer's regional settings.
E	05014039	-	Device login has expired; please try to bind again.
E	05014098	-	The device cannot detect AMS B. Please reconnect the AMS cable or restart the printer.
E	0501409D	-	The firmware of AMS B does not match the printer; the device cannot continue working. Please update it on the 'Firmware' page.
E	050140A3	-	AMS(or AMS lite) B communication is abnormal. Please reconnect the module cable or restart the printer.
E	05024001	-	Current filament will be used in this print job. Settings cannot be changed.
E	05024002	-	Please go to “Settings > Calibration” to run the Motion Accuracy Enhancement Calibration before turning on Motion Accuracy Enhancement mode.
E	05024003	-	The printer is currently printing and the motion accuracy enhancement feature cannot be turned on or off.
E	05024004	-	Some features are not supported by the current device. Please check the Studio feature settings or update the firmware to the latest version.
E	05024005	-	The AMS has not been calibrated yet, so printing cannot be initiated.
E	05024006	-	Unknown module detected; please try updating the firmware to the latest version.
E	05024007	-	
E	05024008	-	
E	05024009	-	
E	0502400A	-	
E	0502400B	-	
E	0502400C	-	
E	0502400D	-	Failed to start a new task: filament loading/unloading not completed.
E	0502400E	-	Failed to start a new task: The nozzle cold pull was not completed.
E	05024013	-	This device is not compatible with the 40W laser module. Please replace it with a 10W laser module or remove it.
E	05024098	-	The device cannot detect AMS C. Please reconnect the AMS cable or restart the printer.
E	0502409D	-	The firmware of AMS C does not match the printer; the device cannot continue working. Please upgrade it on the 'Firmware' page.
E	050240A3	-	AMS(or AMS lite) C communication is abnormal. Please reconnect the module cable or restart the printer.
E	0502C00F	-	The device is busy and cannot perform nozzle identification.
E	0502C010	-	Due to printer power limitations, printing, calibration, controls and other actions cannot be performed during AMS drying. Please stop the drying process before proceeding with any other operation.
E	0502C011	-	Currently in 2D production mode. Please continue the operation on the printer
E	0502C012	-	The task cannot be paused.
E	0502C014	-	The AMS Remaining Filament Estimation is enabled by default and cannot be disabled.
E	0502C024	-	The flow dynamic calibration records have exceeded the storage limit. Please delete some historical records in the slicer software before adding new calibration data.
E	05034098	-	The device cannot detect AMS D. Please reconnect the AMS cable or restart the printer.
E	0503409D	-	The firmware of AMS D does not match the printer; the device cannot continue working. Please update it on the 'Firmware' page.
E	050340A3	-	AMS(or AMS lite) D communication is abnormal. Please reconnect the module cable or restart the printer.
E	05804096	-	The device cannot detect AMS-HT A. Please reconnect the AMS-HT cable or restart the printer.
E	0580409C	-	The firmware of AMS-HT A does not match the printer; the device cannot continue working. Please update it on the 'Firmware' page.
E	058040A2	-	AMS-HT A communication is abnormal. Please reconnect the module cable or restart the printer.
E	05814096	-	The device cannot detect AMS-HT B. Please reconnect the AMS-HT cable or restart the printer.
E	0581409C	-	The firmware of AMS-HT B does not match the printer; the device cannot continue working. Please update it on the 'Firmware' page.
E	058140A2	-	AMS-HT B communication is abnormal. Please reconnect the module cable or restart the printer.
E	05824096	-	The device cannot detect AMS-HT C. Please reconnect the AMS-HT cable or restart the printer.
E	0582409C	-	The firmware of AMS-HT C does not match the printer; the device cannot continue working. Please update it on the 'Firmware' page.
E	058240A2	-	AMS-HT C communication is abnormal. Please reconnect the module cable or restart the printer.
E	05834096	-	The device cannot detect AMS-HT D. Please reconnect the AMS-HT cable or restart the printer.
E	0583409C	-	The firmware of AMS-HT D does not match the printer; the device cannot continue working. Please update it on the 'Firmware' page.
E	058340A2	-	AMS-HT D communication is abnormal. Please reconnect the module cable or restart the printer.
E	05844096	-	The device cannot detect AMS-HT F. Please reconnect the AMS-HT cable or restart the printer.
E	0584409C	-	The firmware of AMS-HT E does not match the printer; the device cannot continue working. Please update it on the 'Firmware' page.
E	058440A2	-	AMS-HT E communication is abnormal. Please reconnect the module cable or restart the printer.
E	05854096	-	The device cannot detect AMS-HT E. Please reconnect the AMS-HT cable or restart the printer.
E	0585409C	-	The firmware of AMS-HT F does not match the printer; the device cannot continue working. Please update it on the 'Firmware' page.
E	058540A2	-	AMS-HT F communication is abnormal. Please reconnect the module cable or restart the printer.
E	05864096	-	The device cannot detect AMS-HT G. Please reconnect the AMS-HT cable or restart the printer.
E	0586409C	-	The firmware of AMS-HT G does not match the printer; the device cannot continue working. Please update it on the 'Firmware' page.
E	058640A2	-	AMS-HT G communication is abnormal. Please reconnect the module cable or restart the printer.
E	05874096	-	The device cannot detect AMS-HT H. Please reconnect the AMS-HT cable or restart the printer.
E	0587409C	-	The firmware of AMS-HT H does not match the printer; the device cannot continue working. Please upgrade it on the 'Firmware' page.
E	058740A2	-	AMS-HT H communication is abnormal. Please reconnect the module cable or restart the printer.
E	05FE8053	-	The left nozzle is not matched with slicing file. Please initiate the print after re-slicing, or continue printing after replacing with the correct nozzle. Caution: the hotend temperature is high.
E	05FE8069	-	Unable to recognize the left hotend. It might be a third party hotend, or the hotend mark may be dirty. Please manually set the hotend type.
E	05FE806A	-	Unable to recognize the left hotend. It might be a third party hotend, or the hotend mark may be dirty. Please set hotend type on printer screen before next print.
E	05FE8080	-	The left hotend is not installed.
E	05FE8081	-	The left hotend is not installed.
E	05FF8053	-	The right nozzle is not matched with slicing file. Please initiate the print after re-slicing, or continue printing after replacing with the correct nozzle. Caution: the hotend temperature is high.
E	05FF8069	-	Unable to recognize the right hotend. It might be a third party hotend, or the hotend mark may be dirty. Please manually set the hotend type.
E	05FF806A	-	Unable to recognize the right hotend. It might be a third party hotend, or the hotend mark may be dirty. Please set hotend type on printer screen before next print.
E	05FF8080	-	The right hotend is not installed.
E	05FF8081	-	The right hotend is not installed.
E	07004001	-	The AMS has been disabled for a print, but it still has filament loaded. Please unload the AMS filament and switch to the spool holder filament for printing.
E	07004025	-	Failed to read the filament information.
E	07008001	-	Failed to cut the filament. Please check the cutter.
E	07008002	-	The cutter is stuck. Please make sure the cutter handle is out.
E	07008003	-	Failed to pull out the filament from the extruder. This might be caused by clogged extruder or filament broken inside the extruder.
E	07008004	-	AMS failed to pull back filament. This could be due to a stuck spool or the end of the filament being stuck in the path.
E	07008005	-	The AMS failed to send out filament. You can clip the end of your filament flat, and reinsert. If this message persists, please check the PTFE tubes in AMS for any signs of wear and tear.
E	07008006	-	Unable to feed filament into the extruder. This could be due to an entangled filament or a stuck spool. If not, please check if the AMS PTFE tube is connected.
E	07008006	H2D	Unable to feed filament into the extruder. The AMS may be mismatched with the extruder. You can rerun the AMS Setup. This could also be due to an entangled filament or a stuck spool. If not, please check if the AMS PTFE tube is connected.
E	07008007	-	Extruding filament failed. The extruder might be clogged.
E	07008007	P2S,H2S,H2D	Failed to extrude the filament. Please check Assistant for more details.
E	0700800A	-	PTFE tube disconnection detected. Please check if the PTFE tube from AMS A to the extruder is properly connected.
E	07008010	-	The AMS assist motor is overloaded. This could be due to entangled filament or a stuck spool.
E	07008011	-	AMS filament ran out. Please insert a new filament into the same AMS slot.
E	07008012	-	Failed to get AMS mapping table; please select 'Resume' to retry.
E	07008013	-	Timeout purging old filament: Please check if the filament is stuck or the extruder is clogged.
E	07008016	-	The extruder is not extruding normally; please refer to the Assistant. After trouble shooting. If the defects are acceptable, please resume.
E	07008017	-	AMS A is drying. Please stop drying process before loading/unloading material.
E	07008021	-	AMS setup failed; please refer to the assistant.
E	07008023	-	AMS A cooling failed. The ambient temperature may be too high. Please operate the device in a suitable environment.
E	0700C069	-	An error occurred during AMS A drying. Please go to Assistant for more details.
E	0700C06A	-	AMS A is reading RFID. Unable to start drying. Please try again later.
E	0700C06B	-	AMS A is changing filament. Unable to start drying. Please try again later.
E	0700C06C	-	AMS A is in Feed Assist Mode. Unable to start drying. Please try again later.
E	0700C06D	-	AMS A is assisting in filament insertion. Unable to start drying. Please try again later.
E	0700C06E	-	AMS A motor is performing self-test. Unable to start drying. Please try again later.
E	07014001	-	Filament is still loaded from the AMS after it has been disabled. Please unload the filament, load from the spool holder, and restart printing.
E	07014025	-	Failed to read the filament information.
E	07018001	-	Failed to cut the filament. Please check the cutter.
E	07018002	-	The cutter is stuck. Please make sure the cutter handle is out.
E	07018003	-	Failed to pull out the filament from the extruder. This might be caused by clogged extruder or filament broken inside the extruder.
E	07018004	-	AMS failed to pull back filament. This could be due to a stuck spool or the end of the filament being stuck in the path.
E	07018005	-	The AMS failed to send out filament. You can clip the end of your filament flat, and reinsert. If this message persists, please check the PTFE tubes in AMS for any signs of wear and tear.
E	07018006	-	Unable to feed filament into the extruder. This could be due to an entangled filament or a stuck spool. If not, please check if the AMS PTFE tube is connected.
E	07018006	H2D	Unable to feed filament into the extruder. The AMS may be mismatched with the extruder. You can rerun the AMS Setup. This could also be due to an entangled filament or a stuck spool. If not, please check if the AMS PTFE tube is connected.
E	07018007	-	Extruding filament failed. The extruder might be clogged.
E	07018007	P2S,H2S,H2D	Failed to extrude the filament. Please check Assistant for more details.
E	0701800A	-	PTFE tube disconnection detected. Please check if the PTFE tube from AMS B to the extruder is properly connected.
E	07018010	-	The AMS assist motor is overloaded. This could be due to entangled filament or a stuck spool.
E	07018011	-	AMS filament ran out. Please insert a new filament into the same AMS slot.
E	07018012	-	Failed to get AMS mapping table; please select 'Resume' to retry.
E	07018013	-	Timeout purging old filament: Please check if the filament is stuck or the extruder is clogged.
E	07018016	-	The extruder is not extruding normally; please refer to the Assistant. After trouble shooting. If the defects are acceptable, please resume.
E	07018017	-	AMS B is drying. Please stop drying process before loading/unloading material.
E	07018021	-	AMS setup failed; please refer to the assistant.
E	07018023	-	AMS B cooling failed. The ambient temperature may be too high. Please operate the device in a suitable environment.
E	0701C069	-	An error occurred during AMS B drying. Please go to Assistant for more details.
E	0701C06A	-	AMS B is reading RFID. Unable to start drying. Please try again later.
E	0701C06B	-	AMS B is changing filament. Unable to start drying. Please try again later.
E	0701C06C	-	AMS B is in Feed Assist Mode. Unable to start drying. Please try again later.
E	0701C06D	-	AMS B is assisting in filament insertion. Unable to start drying. Please try again later.
E	0701C06E	-	AMS B motor is performing self-test. Unable to start drying. Please try again later.
E	07024001	-	Filament is still loaded from the AMS after it has been disabled. Please unload the filament, load from the spool holder, and restart printing.
E	07024025	-	Failed to read the filament information.
E	07028001	-	Failed to cut the filament. Please check the cutter.
E	07028002	-	The cutter is stuck. Please make sure the cutter handle is out.
E	07028003	-	Failed to pull out the filament from the extruder. This might be caused by clogged extruder or filament broken inside the extruder.
E	07028004	-	AMS failed to pull back filament. This could be due to a stuck spool or the end of the filament being stuck in the path.
E	07028005	-	The AMS failed to send out filament. You can clip the end of your filament flat, and reinsert. If this message persists, please check the PTFE tubes in AMS for any signs of wear and tear.
E	07028006	-	Unable to feed filament into the extruder. This could be due to an entangled filament or a stuck spool. If not, please check if the AMS PTFE tube is connected.
E	07028006	H2D	Unable to feed filament into the extruder. The AMS may be mismatched with the extruder. You can rerun the AMS Setup. This could also be due to an entangled filament or a stuck spool. If not, please check if the AMS PTFE tube is connected.
E	07028007	-	Extruding filament failed. The extruder might be clogged.
E	07028007	P2S,H2S,H2D	Failed to extrude the filament. Please check Assistant for more details.
E	0702800A	-	PTFE tube disconnection detected. Please check if the PTFE tube from AMS C to the extruder is properly connected.
E	07028010	-	The AMS assist motor is overloaded. This could be due to entangled filament or a stuck spool.
E	07028011	-	AMS filament ran out. Please insert a new filament into the same AMS slot.
E	07028012	-	Failed to get AMS mapping table; please select 'Resume' to retry.
E	07028013	-	Timeout purging old filament: Please check if the filament is stuck or the extruder is clogged.
E	07028016	-	The extruder is not extruding normally; please refer to the Assistant. After trouble shooting. If the defects are acceptable, please resume.
E	07028017	-	AMS C is drying. Please stop drying process before loading/unloading material.
E	07028021	-	AMS setup failed; please refer to the assistant.
E	07028023	-	AMS C cooling failed. The ambient temperature may be too high. Please operate the device in a suitable environment.
E	0702C069	-	An error occurred during AMS C drying. Please go to Assistant for more details.
E	0702C06A	-	AMS C is reading RFID. Unable to start drying. Please try again later.
E	0702C06B	-	AMS C is changing filament. Unable to start drying. Please try again later.
E	0702C06C	-	AMS C is in Feed Assist Mode. Unable to start drying. Please try again later.
E	0702C06D	-	AMS C is assisting in filament insertion. Unable to start drying. Please try again later.
E	0702C06E	-	AMS C motor is performing self-test. Unable to start drying. Please try again later.
E	07034001	-	Filament is still loaded from the AMS after it has been disabled. Please unload the filament, load from the spool holder, and restart printing.
E	07034025	-	Failed to read the filament information.
E	07038001	-	Failed to cut the filament. Please check the cutter.
E	07038002	-	The cutter is stuck. Please make sure the cutter handle is out.
E	07038003	-	Failed to pull out the filament from the extruder. This might be caused by clogged extruder or filament broken inside the extruder.
E	07038004	-	AMS failed to pull back filament. This could be due to a stuck spool or the end of the filament being stuck in the path.
E	07038005	-	The AMS failed to send out filament. You can clip the end of your filament flat, and reinsert. If this message persists, please check the PTFE tubes in AMS for any signs of wear and tear.
E	07038006	-	Unable to feed filament into the extruder. This could be due to an entangled filament or a stuck spool. If not, please check if the AMS PTFE tube is connected.
E	07038006	H2D	Unable to feed filament into the extruder. The AMS may be mismatched with the extruder. You can rerun the AMS Setup. This could also be due to an entangled filament or a stuck spool. If not, please check if the AMS PTFE tube is connected.
E	07038007	-	Extruding filament failed. The extruder might be clogged.
E	07038007	P2S,H2S,H2D	Failed to extrude the filament. Please check Assistant for more details.
E	0703800A	-	PTFE tube disconnection detected. Please check if the PTFE tube from AMS D to the extruder is properly connected.
E	07038010	-	The AMS assist motor is overloaded. This could be due to entangled filament or a stuck spool.
E	07038011	-	AMS filament ran out. Please insert a new filament into the same AMS slot.
E	07038012	-	Failed to get AMS mapping table; please select 'Resume' to retry.
E	07038013	-	Timeout purging old filament: Please check if the filament is stuck or the extruder is clogged.
E	07038016	-	The extruder is not extruding normally; please refer to the Assistant. After trouble shooting. If the defects are acceptable, please resume.
